{
  "authority_profile": "architecture_decision",
  "conflicts": [],
  "created_at": "2026-08-08T14:27:29-04:00",
  "excluded_sources": [
    {
      "document_id": "codexify:doc:architecture:adr-index",
      "exclusion_reason": "Structural ADR routing does not outrank or add decision authority to the selected accepted ADRs and normative contracts."
    },
    {
      "document_id": "codexify:doc:architecture:current-state",
      "exclusion_reason": "Scoped release authority is not universal architecture-decision authority for this bounded DLG/PAO governance question."
    },
    {
      "document_id": "codexify:doc:architecture:kb-entrypoint",
      "exclusion_reason": "Structural architecture orientation does not outrank the selected accepted ADRs and normative contracts."
    },
    {
      "document_id": "codexify:doc:axis-node:readme",
      "exclusion_reason": "Structural Axis orientation is outside the bounded DLG/PAO decision chain and grants no architecture approval."
    },
    {
      "document_id": "codexify:doc:proof:2026-08-07-dlg-pao-canonical-history-publication",
      "exclusion_reason": "Historical publication evidence is unnecessary for the bounded current architecture-decision question and remains evidence-only."
    }
  ],
  "graph_revision": "5fd8431fa3bac6cc9b2939bcdf24784562738404137bedb4b315c77706f30db3",
  "human_decisions_required": [],
  "illustrative": true,
  "notice": "Representative DLG Phase 3B calibration fixture; generated and reconstructable from the pinned Phase 3A graph. It is not a runtime retrieval receipt, not execution authorization, not architecture approval, and not proof beyond the selected sources' evidence boundaries.",
  "packet_id": "codexify:arp:representative-dlg-pao-architecture",
  "proof_gaps": [],
  "question_or_intent": "Which accepted documents govern the Document Lifecycle Graph and its Product Architecture Ontology extension, and what dependency chain connects them?",
  "reading_budget": {
    "maximum_hops": 2,
    "maximum_sections_per_source": 6,
    "maximum_sources": 4,
    "maximum_total_chunks": 28
  },
  "repository_revision": "1c51187427d843af88bc7fbd2dc7cea58c892fd3",
  "resolved_pointers": [],
  "schema_version": "1.0.0",
  "selected_sources": [
    {
      "authority_class": "accepted_adr",
      "authority_scope": "Document Lifecycle Graph architecture and governance",
      "document_id": "codexify:doc:adr:056-document-lifecycle-graph-control-plane",
      "evidence_class": "documented-contract",
      "freshness_state": "current",
      "graph_path": [
        {
          "from_document_id": "codexify:doc:architecture:product-lanes-and-boundaries",
          "relation_type": "governed_by",
          "to_document_id": "codexify:doc:adr:057-product-architecture-ontology-dlg-integration"
        },
        {
          "from_document_id": "codexify:doc:adr:057-product-architecture-ontology-dlg-integration",
          "relation_type": "depends_on",
          "to_document_id": "codexify:doc:adr:056-document-lifecycle-graph-control-plane"
        }
      ],
      "path": "docs/architecture/adr/056-document-lifecycle-graph-control-plane.md",
      "required_sections": [
        "Decision",
        "Authority and truth boundary",
        "Rollout posture",
        "Non-goals"
      ],
      "retrieval_priority": "primary",
      "selection_reason": "Applicable accepted foundation ADR reached through the reviewed Product Lanes -> ADR-057 -> ADR-056 dependency chain; it governs DLG architecture but does not prove runtime implementation."
    },
    {
      "authority_class": "accepted_adr",
      "authority_scope": "Product Architecture Ontology integration with the DLG",
      "document_id": "codexify:doc:adr:057-product-architecture-ontology-dlg-integration",
      "evidence_class": "documented-contract",
      "freshness_state": "current",
      "graph_path": [
        {
          "from_document_id": "codexify:doc:architecture:product-lanes-and-boundaries",
          "relation_type": "governed_by",
          "to_document_id": "codexify:doc:adr:057-product-architecture-ontology-dlg-integration"
        }
      ],
      "path": "docs/architecture/adr/057-product-architecture-ontology-dlg-integration.md",
      "required_sections": [
        "Decision",
        "Governing ADRs and alignment",
        "Explicitly deferred work",
        "Non-goals"
      ],
      "retrieval_priority": "primary",
      "selection_reason": "Applicable accepted PAO-extension ADR reached through the reviewed Product Lanes governed_by edge; it follows ADR-056 within the accepted dependency chain and grants no runtime proof."
    },
    {
      "authority_class": "normative_contract",
      "authority_scope": "DLG relationship and graph invariants",
      "document_id": "codexify:doc:architecture:document-lifecycle-graph-contract",
      "evidence_class": "documented-contract",
      "freshness_state": "current",
      "graph_path": [
        {
          "from_document_id": "codexify:doc:architecture:product-lanes-and-boundaries",
          "relation_type": "depends_on",
          "to_document_id": "codexify:doc:architecture:document-lifecycle-graph-contract"
        }
      ],
      "path": "docs/architecture/document-lifecycle-graph-contract.md",
      "required_sections": [
        "Canonical token domains and orthogonal axes",
        "Graph invariants",
        "Staged corpus migration"
      ],
      "retrieval_priority": "primary",
      "selection_reason": "Normative DLG contract reached through the reviewed Product Lanes depends_on edge; it supplies graph doctrine below the applicable accepted ADR tier and is not implementation proof."
    },
    {
      "authority_class": "normative_contract",
      "authority_scope": "product-architecture dependency and projection doctrine",
      "document_id": "codexify:doc:architecture:product-lanes-and-boundaries",
      "evidence_class": "documented-contract",
      "freshness_state": "current",
      "graph_path": [],
      "path": "docs/architecture/product-lanes-and-boundaries.md",
      "required_sections": [
        "Relationship to the DLG",
        "Product Architecture relationship vocabulary",
        "Allowed dependency directions",
        "Non-goals"
      ],
      "retrieval_priority": "primary",
      "selection_reason": "Required normative root for the PAO extension and its reviewed governance/dependency edges; it defines doctrine, not current assertion context or runtime behavior."
    }
  ],
  "stale_warnings": [],
  "supersession_chains": [],
  "unavailable_sources": []
}
